{
  "schemaVersion": "ppflight.agent-vendor-manifest/v1",
  "bundleVersion": "3.1.2",
  "catalogRevision": "2026-09-02.2",
  "catalogSha256": "a28236be654c53f2a309358764fe67fc61b167f9ea658b1bde3f8b06521a1944",
  "entrypoint": "tools/ppflight-template-bootstrap.py",
  "files": [
    {
      "path": "build-cloud-templates.sh",
      "sha256": "25458a7f7333c34b8e488ab5ce0f041aebfab1d23c3c0333e696d0ed4361be82",
      "requiredAtRuntime": true
    },
    {
      "path": "tools/ppflight-template-bootstrap.py",
      "sha256": "2a367d8a02fba46951acdb71e79e88f25a91f4f34c27281bbeb51a72541b29fc",
      "requiredAtRuntime": true
    },
    {
      "path": "catalog/template-catalog.v1.json",
      "sha256": "a28236be654c53f2a309358764fe67fc61b167f9ea658b1bde3f8b06521a1944",
      "requiredAtRuntime": true
    },
    {
      "path": "catalog/template-catalog.schema.json",
      "sha256": "dad62bedb27eee96b39f66f431937b9fbe63ed928750fc3d7743945e85ad9dc1",
      "requiredAtRuntime": true
    },
    {
      "path": "contracts/template-bootstrap-request.schema.json",
      "sha256": "1fbe8219bc108d3b863acce8f61cebd39a0984b8126c8d97b972f7feaea93c92",
      "requiredAtRuntime": true
    },
    {
      "path": "contracts/template-bootstrap-result.schema.json",
      "sha256": "b973c6cbae8baa73c6732b094bee63c0fdd9d6de7d4a3755cca59c47773a4b8d",
      "requiredAtRuntime": true
    },
    {
      "path": "contracts/template-storage-discovery.schema.json",
      "sha256": "b1dfa128b4801fd48746eb12e246d3109ec06964ed8f260b3e81917e401cbf23",
      "requiredAtRuntime": true
    },
    {
      "path": "contracts/agent-vendor-manifest.schema.json",
      "sha256": "eb7bf7dbcd670fd932abbbd698b79a099aaa908c4fc17ac890c6caffd6eb68df",
      "requiredAtRuntime": false
    }
  ],
  "dependencies": {
    "python": ">=3.9",
    "bash": ">=5",
    "commands": [
      "awk",
      "bash",
      "cat",
      "chmod",
      "curl",
      "date",
      "df",
      "dirname",
      "findmnt",
      "flock",
      "grep",
      "id",
      "install",
      "ip",
      "mv",
      "perl",
      "pvecm",
      "pvesh",
      "pvesm",
      "pveversion",
      "python3",
      "qemu-img",
      "qm",
      "rm",
      "sed",
      "sha256sum",
      "sha512sum",
      "stat",
      "vzdump"
    ],
    "perlModules": ["JSON::PP"]
  },
  "networkHosts": [
    "cloud-images.ubuntu.com",
    "repo.almalinux.org",
    "cloud.debian.org",
    "cloud.centos.org"
  ],
  "networkRedirectPolicy": {
    "allowed": true,
    "schemes": ["https"],
    "addressFamily": "ipv4-only",
    "hostPolicy": "upstream-selected",
    "integrityPolicy": "catalog-sha256-and-official-checksum"
  }
}
